<?xml version="1.0" encoding="UTF-8"?>
<portfolio xmlns:xsi="http://www.w3.org/2001/XMLSchema-instance" xsi:noNamespaceSchemaLocation="portfolio.xsd">
    
    <!-- ========================================== -->
    <!-- PROFIL ET CONTACT                          -->
    <!-- ========================================== -->
    <profil>
        <nom>Khejia Fanambimiadantsoa</nom>
        <titres>
            <titre lang="fr">Ingénieure Informatique</titre>
            <titre lang="en">Software Engineer</titre>
            <titre lang="zh">软件工程师</titre>
        </titres>
        <accroches>
            <accroche lang="fr">Étudiante ingénieure informatique en 2e année (alternance Systèmes, Réseaux &amp; Data). Je recherche un stage de 9 semaines (mars – août 2027) orienté Gestion de projet, QA ou coordination d'équipes techniques.</accroche>
            <accroche lang="en">...</accroche>
            <accroche lang="zh">...</accroche>
        </accroches>
        <contacts>
            <telephone>07 74 55 21 37</telephone>
            <email>khejia6@gmail.com</email>
            <linkedin>https://www.linkedin.com/in/khejia-fanambimiadantsoa-32b298261/</linkedin>
            <github>https://github.com/Elianna6</github>
        </contacts>
    </profil>

    <!-- ========================================== -->
    <!-- EXPERIENCES PROFESSIONNELLES               -->
    <!-- ========================================== -->
    <experiences>
        <experience id="exp1">
            <dates>Oct. 2025 – Août 2027</dates>
            <entreprise>Bettane + Desseauve</entreprise>
            <intitules>
                <intitule lang="fr">Alternante Administration Système &amp; Réseaux</intitule>
                <intitule lang="en">...</intitule>
                <intitule lang="zh">...</intitule>
            </intitules>
            <descriptions>
                <description lang="fr">Gestion de projet &amp; coordination, QA applicative, supervision d'infrastructure (Zabbix, Grafana), déploiement d'IA locales (Ollama), administration réseaux (VLANs, Proxmox VE).</description>
                <description lang="en">...</description>
                <description lang="zh">...</description>
            </descriptions>
        </experience>
        
        <experience id="exp2">
            <dates>2023</dates>
            <entreprise>Salvia Développement</entreprise>
            <intitules>
                <intitule lang="fr">Stage — Découverte DSI</intitule>
                <intitule lang="en">...</intitule>
                <intitule lang="zh">...</intitule>
            </intitules>
            <descriptions>
                <description lang="fr">Traitement et visualisation de données via Power BI.</description>
                <description lang="en">...</description>
                <description lang="zh">...</description>
            </descriptions>
        </experience>
    </experiences>

    <!-- ========================================== -->
    <!-- PROJETS ACADEMIQUES                        -->
    <!-- ========================================== -->
    <projets>
        <projet id="proj1">
            <titres>
                <titre lang="fr">Bibliothèque Numérique</titre>
                <titre lang="en">...</titre>
                <titre lang="zh">...</titre>
            </titres>
            <descriptions>
                <description lang="fr">Infrastructure complète avec Python, FastAPI &amp; PostgreSQL.</description>
                <description lang="en">...</description>
                <description lang="zh">...</description>
            </descriptions>
        </projet>

        <projet id="proj2">
            <titres>
                <titre lang="fr">Codage de Huffman</titre>
                <titre lang="en">...</titre>
                <titre lang="zh">...</titre>
            </titres>
            <descriptions>
                <description lang="fr">Implémentation complète de l'algorithme de compression.</description>
                <description lang="en">...</description>
                <description lang="zh">...</description>
            </descriptions>
        </projet>
    </projets>

    <!-- ========================================== -->
    <!-- FORMATIONS                                 -->
    <!-- ========================================== -->
    <formations>
        <formation id="form1">
            <dates>2024 – 2027</dates>
            <ecole>Sup Galilée, Univ. Sorbonne Paris Nord</ecole>
            <intitules>
                <intitule lang="fr">Ingénieure Informatique</intitule>
                <intitule lang="en">...</intitule>
                <intitule lang="zh">...</intitule>
            </intitules>
        </formation>
    </formations>

</portfolio>
